{
  "$schema": "https://json-schema.org/draft/2020-12/schema",
  "title": "HostAttributes",
  "type": "object",
  "properties": {
    "name": {
      "type": "string",
      "description": "The human-readable name of the host."
    },
    "type_of": {
      "type": "string",
      "description": "The hosting type."
    },
    "server": {
      "type": "string",
      "description": "The host URL for SFTP hosts."
    },
    "port": {
      "type": "integer",
      "description": "The server port for SFTP hosts."
    },
    "path": {
      "type": "string",
      "description": "The URL path suffix for SFTP hosts."
    },
    "username": {
      "type": "string",
      "description": "The authentication username for SFTP hosts."
    },
    "encrypted_private_key": {
      "type": "string",
      "description": "The encrypted private key for SFTP hosts."
    },
    "skip_symlinks": {
      "type": "boolean",
      "description": "Whether to use file copying instead of symbolic links for SFTP hosts."
    },
    "status": {
      "type": "string",
      "description": "The current status of the host."
    },
    "created_at": {
      "type": "string"
    },
    "updated_at": {
      "type": "string"
    }
  }
}