{
  "name": "Example Title",
  "type_of": "example_value",
  "server": "example_value",
  "port": 10,
  "path": "example_value",
  "username": "example_value",
  "encrypted_private_key": "example_value",
  "skip_symlinks": true,
  "status": "example_value",
  "created_at": "2026-01-15T10:30:00Z",
  "updated_at": "2026-01-15T10:30:00Z"
}